date,company,role,status,resume_file,cover_letter_file,notes
2026-02-01,1Password,Vice President of Data Analytics,draft,Matt Oremland_1Password_Vice President of Data Analytics_resume.docx,yes,"VP-level, reports to CFO. Strong fit on leadership, governance, cross-functional translation, technical depth. Gaps: no Tableau/Looker/Power BI, no SaaS or cybersecurity domain experience. High comp range ($272-368k)."
2026-02-01,ActBlue,"Director of Engineering, Data Science & Engineering",draft,Matt Oremland_ActBlue_Director of Engineering Data Science  Engineering_resume.docx,yes,"Nonprofit political tech. Gaps: no 20+ person org leadership, no full production ML/AI systems at scale, no political/electoral background. Bridging: emphasize production model deployment (Paradigm), data lake and governance builds, cross-functional leadership, and mission-driven culture fit."
2026-02-01,Apogee Therapeutics,"Director, Data Engineering & Analytics",draft,Matt Oremland_Apogee Therapeutics_Director Data Engineering  Analytics_resume.docx,yes,"Clinical-stage biotech, hands-on IC role with eventual team leadership. Strong fit: pharma, Snowflake, Databricks, Python, SQL, data governance, cross-functional work. No hard requirement gaps identified."
2026-02-01,Hello Heart,"Director, Analytics",draft,Matt Oremland_Hello Heart_Director Analytics_resume.docx,yes,"Digital health company, Director-level analytics leadership. Strong fit on leadership, governance, cross-functional work, team management. Gap: no Tableau experience (have Sigma, Spotfire, Sigma). EST zone - matches."
2026-02-01,Incyte,Machine Learning Engineer,draft,Matt Oremland_Incyte_Machine Learning Engineer_resume.docx,yes,"Pharma AI/ML IC role. Strong fit: LLM-based production model (OpenAI), pharma domain, Python, scikit-learn, cross-functional collaboration. Gaps: limited AWS infrastructure experience (storage, not compute/SageMaker), deployment was handed to engineering. Bridging: emphasize model design and validation ownership, TensorFlow/PyTorch consulting history, pharma domain depth."
2026-02-01,Super.com,Director of Analytics & Data Science,draft,Matt Oremland_Supercom_Director of Analytics  Data Science_resume.docx,yes,"High-growth travel/fintech. Borderline fit - strong on Snowflake, Python, SQL, cross-functional leadership, analytics org design. Gaps: no manager-of-managers experience, no Looker/dbt. Their stack is mature (Snowflake, dbt, Amplitude) so need to emphasize adaptability to modern data stacks."
2026-02-01,Symetra,"Assistant Vice President, Data Analytics",draft,Matt Oremland_Symetra_Assistant Vice President Data Analytics_resume.docx,yes,"Life insurance company, AVP-level. Strong fit on analytics leadership, governance, predictive modeling, cross-functional partnership, team development. Gap: no insurance domain experience. Framing: regulated industry analytics leader transferring risk modeling and enterprise data transformation skills from pharma."
